<?xml version="1.0" encoding="utf-8"?>
<!DOCTYPE regular-module SYSTEM "../dtd/regular-module.dtd">
<regular-module name="guardian" to-string-ts="guardian.code + '-' + guardian.nametitle.name + ' ' + guardian.callingname" to-string-java="guardian.getCode() + #quat;-#quat; + guardian.getNametitle.getName() + #quat; #quat; + guardian.getCallingname()">
    <code length="10" prefix="GU" searchable="yes" exist-on-table="yes"/>
    <group>
        <reference-property basic="yes" required="yes" width="4" name="nametitle" label="Title" referenced-from="nametitle" service-method="getAll" to-string-java="nametitle.getName()" to-string-ts="nametitle.name"/>
        <varchar-property basic="yes" exist-on-table="yes" searchable="yes" required="yes" width="8" name="callingname" label="Calling Name" example="Sandun"/>
    </group>
    <group>
        <reference-property width="4" name="civilstatus" label="Civilstatus" referenced-from="civilstatus" service-method="getAll" to-string-ts="civilstatus.name" to-string-java="civilstatus.getName()"/>
        <varchar-property width="8" required="yes" name="fullname" label="Full Name" example="Kamal Perera"/>
    </group>

    <reference-property name="gender" label="Gender" referenced-from="gender" service-method="getAll" to-string-java="gender.getName()" to-string-ts="gender.name"/>
    <varchar-property unique="yes" required="yes" exist-on-table="yes" searchable="yes"  name="nic" label="NIC Number" example="940081009V" min-length="10" max-length="12" pattern="^(([0-9]{12})|([0-9]{9}[vVxX]))$"/>


    <group>
        <char-property unique="yes" name="mobile" label="Mobile Number" example="0789456123" size="10" required="yes" width="4" pattern="^([0][0-9]{9})$"/>
        <char-property name="land" label="Land Number" example="0789455123" size="10" width="4" pattern="^([0][0-9]{9})$"/>
        <varchar-property unique="yes" width="4" name="email" label="Email Address" example="user@gmail.com" min-length="5" pattern="^\w+([\.-]?\w+)*@\w+([\.-]?\w+)*(\.\w{2,3})+$"/>
    </group>

    <varchar-property width="6" name="occupation" label="Occupation" example="Doctor" min-length="4" />

    <text-property name="address" label="Home Address" example="123, Colombo Road, Gampaha" min-length="4" required="yes"/>


    <char-property name="officetel1" label="Office Number 1" example="0789456123" size="10" pattern="^([0][0-9]{9})$"/>
    <char-property name="officetel2" label="Office Number 2" example="0339455123" size="10" pattern="^([0][0-9]{9})$"/>

    <text-property name="officeaddress" label="Office Address" example="123, Colombo Road, Gampaha" min-length="4" required="yes"/>


    <text-property name="description" label="Description" example=""/>

</regular-module>


