<?xml version="1.0" encoding="utf-8"?>
<!DOCTYPE regular-module SYSTEM "../dtd/regular-module.dtd">
<regular-module name="student" to-string-ts="student.code + '-' + student.nametitle.name + ' ' + student.callingname" to-string-java="student.getCode() + #quat;-#quat; + student.getNametitle.getName() + #quat; #quat; + student.getCallingname()">
    <code length="10" prefix="ST" searchable="yes" exist-on-table="yes"/>

    <group>
        <reference-property basic="yes" required="yes" width="4" name="nametitle" label="Title" referenced-from="nametitle" service-method="getAll" to-string-java="nametitle.getName()" to-string-ts="nametitle.name"/>
        <varchar-property basic="yes" exist-on-table="yes" searchable="yes" required="yes" width="8" name="callingname" label="Calling Name" example="Sandun"/>
    </group>
    <group>
        <varchar-property  required="yes" name="fullname" label="Full Name" example="Kamal Perera"/>
    </group>
    <file-property basic="yes" name="photo" label="Photo" accept="image/*" exist-on-table="yes"/>
    <file-property basic="yes" name="birthcertificate" label="Birth Certificate" accept="image/*" exist-on-table="yes"/>
    <group>
        <date-property required="yes" width="4" name="dobirth" label="Date Of Birth" example="1994-12-31"/>
        <reference-property required="yes" width="4" name="gender" label="Gender" referenced-from="gender" service-method="getAll" to-string-java="gender.getName()" to-string-ts="gender.name"/>
        <varchar-property unique="yes" exist-on-table="yes" searchable="yes" width="4" name="nic" label="NIC Number" example="940081009V" min-length="10" max-length="12" pattern="^(([0-9]{12})|([0-9]{9}[vVxX]))$"/>
    </group>


    <reference-property  name="guardian" label="Guardian" referenced-from="guardian" service-method="getAllBasic" to-string-java="guardian.getCallingName()+ #quat; #quat; + guardian.getNic()" to-string-ts="guardian.callingname + ' ' + guardian.nic"/>
    <reference-property  name="guardianrelationship" label="Guardian Relationship" referenced-from="guardianrelationship" service-method="getAll" to-string-java="guardianrelationship.getName()" to-string-ts="guardianrelationship.name"/>
    <reference-property  name="bloodtype" label="Blood Type" referenced-from="bloodtype" service-method="getAll" to-string-java="bloodtype.getName()" to-string-ts="bloodtype.name"/>
    <reference-property  name="religion" label="Religion" referenced-from="religion" service-method="getAll" to-string-java="religion.getName()" to-string-ts="religion.name"/>
    <reference-property  name="ethnicity" label="Ethnicity" referenced-from="ethnicity" service-method="getAll" to-string-java="ethnicity.getName()" to-string-ts="ethnicity.name"/>
    <reference-property  name="house" label="House" referenced-from="house" service-method="getAll" to-string-java="house.getName()" to-string-ts="house.name"/>
    <reference-property exist-on-table="yes" insertable="no" default-value="1"  name="studentstatus" label="Student Status" referenced-from="studentstatus" service-method="getAll" to-string-java="studentstatus.getName()" to-string-ts="studentstatus.name"/>


    <group>
        <char-property unique="yes" name="mobile" label="Mobile Number" example="0789456123" size="10" required="yes" width="4" pattern="^([0][0-9]{9})$"/>
        <char-property name="land" label="Land Number" example="0789455123" size="10" width="4" pattern="^([0][0-9]{9})$"/>
        <varchar-property unique="yes" width="4" name="email" label="Email Address" example="user@gmail.com" min-length="5" pattern="^\w+([\.-]?\w+)*@\w+([\.-]?\w+)*(\.\w{2,3})+$"/>
    </group>



    
    <date-property name="joineddate" label="Joined Date" example="" exist-on-table="yes" required="yes"/>



    <text-property name="address" label="Address" example="123, Colombo Road, Gampaha" min-length="4" required="yes"/>


    <decimal-property name="admissionfee" label="Admission Fee" example="" precision="10" scale="2" min="0" max="99999999"/>



    <text-property name="description" label="Description" example=""/>


</regular-module>


