<?xml version="1.0" encoding="utf-8"?>
<!DOCTYPE regular-module SYSTEM "../dtd/regular-module.dtd">
<regular-module name="employee" to-string-ts="employee.code + '-' + employee.nametitle.name + ' ' + employee.callingname" to-string-java="employee.getCode() + #quat;-#quat; + employee.getNametitle.getName() + #quat; #quat; + employee.getCallingname()">
    <code length="8" prefix="EM" searchable="yes" exist-on-table="yes"/>
    <group>
        <reference-property basic="yes" required="yes" width="4" name="nametitle" label="Title" referenced-from="nametitle" service-method="getAll" to-string-java="nametitle.getName()" to-string-ts="nametitle.name"/>
        <varchar-property basic="yes" exist-on-table="yes" searchable="yes" required="yes" width="8" name="callingname" label="Calling Name" example="Sandun"/>
    </group>
    <group>
        <reference-property width="4" name="civilstatus" label="Civilstatus" referenced-from="civilstatus" service-method="getAll" to-string-ts="civilstatus.name" to-string-java="civilstatus.getName()"/>
        <varchar-property width="8" required="yes" name="fullname" label="Full Name" example="Kamal Perera"/>
    </group>
    <file-property basic="yes" name="photo" label="Photo" accept="image/*" exist-on-table="yes"/>
    <group>
        <date-property required="yes" width="4" name="dobirth" label="Date Of Birth" example="1994-12-31"/>
        <reference-property required="yes" width="4" name="gender" label="Gender" referenced-from="gender" service-method="getAll" to-string-java="gender.getName()" to-string-ts="gender.name"/>
        <varchar-property unique="yes" required="yes" exist-on-table="yes" searchable="yes" width="4" name="nic" label="NIC Number" example="940081009V" min-length="10" max-length="12" pattern="^(([0-9]{12})|([0-9]{9}[vVxX]))$"/>
    </group>
    <group>
        <char-property unique="yes" name="mobile" label="Mobile Number" example="0789456123" size="10" required="yes" width="4" pattern="^([0][0-9]{9})$"/>
        <char-property name="land" label="Land Number" example="0789455123" size="10" width="4" pattern="^([0][0-9]{9})$"/>
        <varchar-property unique="yes" width="4" name="email" label="Email Address" example="user@gmail.com" min-length="5" pattern="^\w+([\.-]?\w+)*@\w+([\.-]?\w+)*(\.\w{2,3})+$"/>
    </group>
    <text-property name="address" label="Address" example="123, Colombo Road, Gampaha" min-length="4" required="yes"/>
    <reference-property required="yes" name="designation" label="Designation" referenced-from="designation" exist-on-table="yes" service-method="getAll" to-string-ts="designation.name" to-string-java="designation.getName()"/>
    <reference-property required="yes" default-value="1" insertable="no" searchable="yes" exist-on-table="yes" name="employeestatus" label="Status" referenced-from="employeestatus" service-method="getAll" to-string-java="employeestatus.getName()" to-string-ts="employeestatus.name"/>
    <text-property name="description" label="Description" example=""/>

</regular-module>


